product_id,product_name,product_description,product_category,product_price,supplier_name,supplier_contact,supplier_email,supplier_phone_number,supplier_street_address,supplier_city,supplier_state,supplier_zip_code,stock_quantity,store_name,store_address,store_city,store_state,store_zip_code,store_phone_number
923,STJRNBILD,so they take less space when you're not using them. Made of tempered glass,in,497.4,Tekfly,Adela Barry,abarrypm@google.es,327-119-5799,9 Bartelt Point,General Conesa,,8503,5304,Meevee,67170 Iowa Lane,Santo Niño,,6711,408-103-6477
57,SUFFLETT,both natural materials that are soft against the skin. Lyocell absorbs and transports moisture away and keeps a comfortable sleeping temperature all night long. Its small dimensions make it especially suitable for small rooms or spaces. A good solution where space is limited. You can display one picture on each side as the frame has no back panel. All soft toys are good at hugging,Box,522.16,Wordpedia,Ana Brodeau,abrodeau1k@flavors.me,481-225-5177,8810 Hallows Road,Tymbark,,34-650,6369,Youspan,3 Algoma Terrace,Aragarças,,76240-000,175-972-3585
51,GOSIG GOLDEN,comforting and listening and are fond of play and mischief. In addition,Cot,571.57,Blogtag,Gaye Olek,golek1e@digg.com,320-141-8416,43644 Di Loreto Trail,Soljani,,32255,3143,Devshare,11 Logan Street,Limoeiro de Anadia,,57260-000,431-251-0174
980,LTT,complete the phone with VITAHULT wireless charging cover. The anti-slip backing keeps the door mat firmly in place and reduces the risk of slipping. View more product information You can choose to frame your picture in different ways; close to the front or behind the box frame insert to add depth. And with or without the accompanying mount. Helps you organise small items like desk accessories,Mug,978.22,Muxo,Carmina Ellwell,cellwellr7@rediff.com,311-552-1721,611 Meadow Ridge Street,Koltushi,,188680,4656,Devcast,77105 Commercial Street,Rzhev,,172389,529-914-3282
623,SINDAL,choose whichever fits your space best. View more product information Can be used hanging or standing,Rug,451.46,Leenti,Nicoline Winthrop,nwinthropha@chicagotribune.com,189-746-5897,42071 Northwestern Park,Seka,,43150,2478,Gigashots,1448 Gale Circle,Zhukovo,,249192,781-373-7272
328,STRANDKL,etc. helps you keep your things organised and the table top clear. The glass has a simple,Rug,392.96,Topicstorm,Cristionna Broxap,cbroxap93@qq.com,669-642-2016,59186 Tony Parkway,Rayevskaya,,353983,3576,Trilith,954 Pankratz Trail,Amagi,,891-7611,659-277-2451
182,SUSEN,this warm,Rug,396.38,Camido,Verene Dargan,vdargan51@bing.com,254-657-3633,52 Veith Park,Ramiriquí,,153457,9567,Flashspan,56 Tony Terrace,Dagua,,760529,369-698-3775
84,DUKTIG,traffic signs and railroads  just like in a city. Perfect to combine with toy cars and figures from the LILLABO series. Very easy to assemble with the included rubber bands. Cotton,Rug,53.45,Quimba,Hermy Morican,hmorican2b@amazonaws.com,643-801-8229,3925 2nd Parkway,Niedzica,,34-441,8721,Oyonder,01750 Maryland Drive,San Antonio,TX,78265,210-996-3853
283,RANARP,strong and durable material that's easy to keep clean. A heat indicator shows when the cooking zone has cooled so that you are not in danger of burning yourself. 5 year guarantee. Read about the terms in the guarantee brochure. Gives you extra storage in your kitchen. Hinges are sold separately. SVEDAL has a wide frame that forms a bold pattern around the door. It creates a bright traditional kitchen that is lively and dynamic. 10 year guarantee. Read about the terms in the guarantee brochure. 5 year guarantee. Read about the terms in the guarantee brochure. 5 year guarantee. Read about the terms in the guarantee brochure. 5 year guarantee. Read about the terms in the guarantee brochure. The serving stand is a festive way to serve for example pastries,Rug,179.57,Kayveo,Estelle Castanyer,ecastanyer7u@godaddy.com,441-770-3654,50 Lotheville Alley,Dolní Čermná,,561 53,7640,Jatri,40372 Namekagon Parkway,Ra-ngae,,96130,944-267-3893
874,TROFAST,over a door or standing on a surface  then turn the clock face to suit the location. A plastic inner pot makes the plant pot waterproof. The table surface in ash veneer and legs in solid birch give a warm,Rug,768.84,Skibox,Tammara Purcer,tpurcero9@google.nl,540-871-3675,72311 Warbler Street,Volodarsk,,606072,2311,Buzzdog,29543 Del Sol Drive,Bohutín,,789 62,655-237-7441
834,HLL,m). View more product information 10 year guarantee. Read about the terms in the guarantee brochure. 10 year guarantee. Read about the terms in the guarantee brochure. The glass has a generous shape and weight which makes it pleasant to hold and helps the scents and flavours of the whiskey to develop better,Door,45.35,Youfeed,Laney Fontin,lfontinn5@columbia.edu,169-515-0156,195 David Circle,Boca Chica,,11102,4949,Thoughtsphere,82980 Hoard Park,Barras,,64100-000,221-793-9324
535,RGKORN,a hard-wearing natural material with a slightly irregular texture. Solid wood is a durable natural material. Light bulb sold separately. IKEA recommends LED bulb E27 400 lumen globe opal white. View more product information Gives a directed light; good for lighting up for example dining tables or bar tops. Easy to keep clean since it is machine washable. The fleece throw feels soft against your skin and can be machine washed. Interior accessories  that help you organise inside your wardrobe are sold separately. View more product information If you want to organise inside,Chair,573.46,Oyoba,Wilt Pull,wpulleu@devhub.com,968-318-5343,27 Judy Street,Makarska,,21300,9395,Skyba,5492 Reindahl Way,Paris 09,A8,75455 CEDEX 09,751-799-9713
574,BERNHARD,the dinnerware gives a rustic feel to your table setting. Theres a natural and living feeling of wood,Chair,916.05,Abatz,Linc McCarrick,lmccarrickfx@youku.com,845-356-5892,497 Shasta Point,Quilo-quilo,,4224,8644,Quimba,379 Daystar Junction,Capão da Canoa,,95555-000,824-959-9255
1000,PAX,they are reliable and tested for safety. You sit comfortably since the chair is adjustable in height. You can connect up to 4 pieces in a straight line or an L-shape. Collects your electric and computer cables together; makes it easier to keep your work area tidy. View more product information You get extra soft comfort and support because the thick seat cushions have a core of pocket springs and a top of cut foam and polyester fibres. View more product information Veneered surface; gives the table a natural look and feel. You can use the furniture as a room divider because it looks good from every angle. View more product information Easy to pull out and lift as the box has handles. Cotton,Cover,342.31,Edgeclub,Gabie Rosten,grostenrr@slashdot.org,961-832-0887,248 Lerdahl Plaza,Grecheskoye,,357247,7283,Zoomlounge,1 Canary Plaza,Kraśniczyn,,22-310,721-221-5942
469,STRANDMON,hats and gloves in baskets makes it easier to find what you need and keeps the room looking neat and uncluttered. A terry towel in medium thickness that is soft and highly absorbent (weight 400 g,Frame,438.66,Photobug,Adella Tamsett,atamsettd0@rambler.ru,810-685-1755,71468 Eagle Crest Alley,Žebrák,,263 01,8825,Ntag,84 Summerview Place,Evansville,IN,47747,812-807-2307
175,KNODD,sun,Frame,224.97,Skibox,Hayyim Viger,hviger4u@people.com.cn,271-391-1413,8869 Caliangt Street,Ińsko,,73-140,4431,Fiveclub,56083 Hooker Center,Lanckorona,,34-143,369-331-9303
392,NYM,comforting and listening and are fond of play and mischief. In addition,Frame,695.35,Zazio,Welbie Bea,wbeaav@goo.ne.jp,635-731-4166,801 Lien Lane,Villa General Belgrano,,5195,6780,Livetube,33878 Reinke Place,Akademgorodok,,453019,482-858-7457
472,KAUSTBY,m). Hooks for towels or other things that you want to have within easy reach. View more product information 10 year guarantee. Read about the terms in the guarantee brochure. A terry towel in medium thickness that is soft and highly absorbent (weight 500 g,Frame,408.56,Realbridge,Thibaud Sandwich,tsandwichd3@ibm.com,237-169-0358,5 Westerfield Lane,Voskresensk,,140209,1648,Skinder,57969 Superior Avenue,Falun,W,791 21,606-551-0983
318,INGOLF,as a beautiful object in its own right. The decoration box can be used to display your small favourite items. View more product information The cover is easy to keep clean as it is removable and can be machine washed. Durable,Shelf,397.6,Skipfire,Nicolai Barnwall,nbarnwall8t@netlog.com,688-315-5437,46267 Maryland Plaza,Rostokino,,461149,566,Oyoloo,72044 Village Crossing,Jutaí,,69660-000,909-244-7773
953,IKEA PS LMSK,styles and sizes so that you can easily find the one that suits you and your family best. The rug is hard-wearing and durable because its made of sisal,Table,20.57,Topiczoom,Keefe Willars,kwillarsqg@blog.com,328-177-8913,1 Everett Street,Pszczyna,,43-200,1511,Avamba,04 Carberry Alley,Esperanza,,5131,677-169-7035
608,SFTEN,as the flat-woven surface makes it easy to pull out chairs and clean. View more product information You sit comfortably thanks to the high back and seat with polyester wadding. View more product information Ties keep the chair pad in place. Handwoven by skilled craftspeople,Table,948.11,Yombu,Lucas Brunelleschi,lbrunelleschigv@indiatimes.com,536-348-8266,11995 Charing Cross Alley,Ursynów,,15-134,4804,Oyoba,7 Bluejay Place,Krzyżanów,,99-314,866-207-7339
720,BOSJN,which means it blocks 98% of the ultraviolet radiation. By attaching the grinding mechanism to the IKEA 365+ IHRDIG spice jars,Table,451.19,Voonyx,Chalmers Morrissey,cmorrisseyjz@weebly.com,192-305-8856,50 Darwin Lane,Plato,,475038,4365,Jaxbean,6 Scofield Circle,Askainen,,21240,665-681-8276
323,PRLBLAD,dyed-through 1.2 mm thick grain leather that is supple and smooth to the touch. View more product information As the light can be dimmed,Throw,907.23,Feedfish,Charlie Orrett,corrett8y@tinypic.com,501-519-9804,49378 Shoshone Place,Pitkyaranta,,186810,5796,Trupe,88162 Farwell Place,Steinfort,,L-8453,417-233-0470
511,BIRKET,natural feeling to your room View more product information Untreated solid wood is a durable natural material which is even more hardwearing and easy to look after if you oil or wax the surface. View more product information Made of solid wood,Throw,903.07,Yata,Wally Parlott,wparlotte6@oracle.com,134-891-0107,6652 Continental Road,Dolní Kounice,,664 64,2989,Vimbo,82524 Michigan Point,Novogurovskiy,,301382,780-805-7037
495,NORDEN,just place it on the built-in charger and charging begins. View more product information Gives decorative patterns on the ceiling and on the wall. View more product information Concealed press studs keep the quilt in place. Mohair wool with a silky lustre. Of course your home should be a safe place for the entire family. Thats why a safety fitting is included so that you can attach the chest of drawers to the wall. The boxes in the KVITTRA series are available in several different patterns and sizes  mix and match according to taste,Throw,997.63,Blogtags,Ora Malek,omalekdq@blog.com,994-831-1153,2262 Basil Drive,Bhalwāl,,24011,988,Voolith,26 Union Park,Alicante/Alacant,VC,03005,519-201-6568
481,TORNLIDEN,which makes it perfect for preserving your favourite homemade jams and jellies. View more product information Can also be used as a jug. View more product information Each basket is unique since they are handmade. Handmade by a skilled craftsman. Since the wash-stand is only 32 cm deep,1 pair,701.49,Edgeblab,Iolande Conford,iconforddc@etsy.com,420-666-4797,0 Elka Way,Presidencia Roque Sáenz Peña,,5444,7636,Blogtag,447 Florence Court,Ilinden,,1041,703-709-8678
699,LAGAN,as it is made of rustproof aluminium. Perfect for your balcony or other small spaces as it can be folded up and put away. View more product information Floor decking makes it easy to refresh your terrace or balcony. Ties keep the cushion firmly in place on the chair. Its possible to plant directly into the planter,Basket,170.04,Mymm,Nickolai Dove,ndoveje@adobe.com,930-862-2455,03626 Magdeline Circle,Sarzedo,,32450-000,6832,Jaxbean,7 Schmedeman Plaza,Vyshniy Volochëk,,601803,659-214-5518
695,TIDIG,outdoor use when re-staining the furniture,Handle,170.49,Edgetag,Nickey Sibbs,nsibbsja@myspace.com,484-133-2118,877 Sage Parkway,Sarvaš,,31000,9307,Zoozzy,52463 Barnett Park,Żywiec,,34-330,213-648-5874
835,GGPLANTA,enhancing your experience of the drink. A terry towel in medium thickness that is soft and highly absorbent (weight 550 g,Handle,468.57,Ainyx,Adelind Leverett,aleverettn6@networksolutions.com,295-954-9354,5095 Alpine Pass,Magsaysay,,9221,7919,Lazzy,8473 High Crossing Terrace,Sakai,,999-2256,591-656-1751
293,DEKAD,and add a traditional touch to your kitchen. View more product information 25 year guarantee. Read about the terms in the guarantee brochure. View more product information A plastic inner pot makes the plant pot waterproof. A small,Handle,863.36,Agimba,Christy Jekyll,cjekyll84@unc.edu,902-725-1658,10 Ronald Regan Alley,Dinskaya,,353226,9779,Katz,4238 Homewood Plaza,Palanit,,5700,262-296-5329
513,KLIPPRT,turn and play around with the shape of this hard-wearing rug until you find the perfect spot in your home. Handwoven by skilled craftspeople,Hanger,163.3,Meedoo,Barb Wynch,bwynche8@upenn.edu,350-308-0860,37 Donald Junction,Jasionów,,36-212,5747,Jabbercube,45533 Debra Road,Damayan,,1104,141-239-3052
335,BJURSTA,as it is made of rustproof aluminium. Perfect for your balcony or other small spaces as it can be folded up and put away. View more product information Floor decking makes it easy to refresh your terrace or balcony. Ties keep the cushion firmly in place on the chair. Its possible to plant directly into the planter,Mirror,562.42,Skimia,Archibold Wykey,awykey9a@biglobe.ne.jp,754-697-5989,01 Bartelt Center,Semiletka,,452555,1425,Gabtune,36554 Carpenter Terrace,Bugang,,9803,200-330-9863
421,STENRT,both natural materials that are soft against the skin. Lyocell absorbs and transports moisture away and keeps a comfortable sleeping temperature all night long. Its small dimensions make it especially suitable for small rooms or spaces. A good solution where space is limited. You can display one picture on each side as the frame has no back panel. All soft toys are good at hugging,Mirror,194.7,Skyndu,Cornall Cantillon,ccantillonbo@tinyurl.com,895-119-1946,0 Monica Junction,Petrodvorets,,150501,3102,Tagcat,34 Golf Pass,Parrsboro,NS,L2A,499-319-4814
960,LEVANDE,because the shelf is adjustable. 25 year guarantee. Read about the terms in the guarantee brochure. These white knobs are easy to grip with your fingers and smooth to the touch,Parasol,600.84,Topiczoom,Livy Souness,lsounessqn@gravatar.com,559-532-5526,9131 Bellgrove Circle,Baranowo,,06-320,1457,Skyndu,6776 Bunting Street,Tver,,182647,238-497-8461
965,KRAMIG,colour and texture makes each piece of wood furniture unique. View more product information Create your own personalised pendant or floor lamp by combining the lamp shade with your choice of cord set or base. View more product information Solid wood is a durable natural material. The serving stand is a festive way to serve for example pastries,Parasol,364.07,Oyope,James Hourston,jhourstonqs@ezinearticles.com,379-979-4269,5 Schurz Drive,Otyń,,67-101,9267,Youfeed,30 Vahlen Lane,Minanga Norte,,8209,859-607-7607
46,HEMMAHOS,they are reliable and tested for safety. Extendable,Picture,614.98,Rhybox,Witty Marland,wmarland19@ask.com,532-393-2601,6 Maple Wood Junction,Milaor,,4413,5046,Npath,90147 Hintze Park,Campo de la Cruz,,084047,915-894-3013
970,BETRAKTA,as the box is sturdy. The mirror can be placed on a table or chest of drawers,hanging,201.95,Centidel,Regen Ranken,rrankenqx@yandex.ru,344-243-5983,3 Helena Court,La Unión,,055028,8378,Buzzster,22 Dunning Circle,Richmond,QC,V6Z,411-871-5269
955,VESSLA,with soft edges,outdoor,986.57,Vipe,Andy Richley,arichleyqi@blogtalkradio.com,319-139-2564,883 Comanche Junction,Belozërskoye,,641360,2747,Midel,16 Merrick Junction,Belén,,50504,440-116-0185
982,TOLSBY,and therefore unique in design and size. These white porcelain handles give a good grip and add a traditional touch to your kitchen. View more product information You can easily access the contents as the lid folds open. Easy to keep clean - just vacuum or shake the rug. Easy to keep clean - just vacuum or shake the rug. View more product information Perfect for newspapers,outdoor,2.7,Kwilith,Dasya Dobrovolny,ddobrovolnyr9@sohu.com,629-655-1105,152 Ridgeway Drive,Stanisław Górny,,34-103,522,Divavu,8904 Mcguire Terrace,Bykov,,694062,918-110-4799
944,FJDERMOLN,each one is unique. Made in India in organised weaving centres with good working conditions and fair wages. View more product information The various sections of the seating series can be connected together in different combinations or used separately. View more product information Gives both directed and diffused light. View more product information A plastic inner pot makes the plant pot waterproof. View more product information You can choose between white and black knobs,outdoor,444.44,Wordpedia,Lizabeth Carbry,lcarbryq7@ycombinator.com,864-932-3172,8471 Arrowood Alley,Takanabe,,889-1404,4233,Yata,11 Waubesa Lane,Esquina,,5131,373-619-0948
281,LUDDE,it offers good quality and design at a low price. View more product information 25 year guarantee. Read about the terms in the guarantee brochure. Chrome-plated brass is a hard and durable surface that is easy to clean. Sink in stainless steel,Armchair,322.82,Yakijo,Dorothee Korlat,dkorlat7s@bloglovin.com,403-255-6239,0 Hovde Way,Uzlovaya,,301649,5444,Jabbersphere,5 Spohn Hill,La Playosa,,5911,810-786-1524
633,TERTIAL,thanks to the three different heights. The thick pile dampens sound and provides a soft surface to walk on. You can have fun colouring and personalising each building any way you like. Your child can showcase their art creations,Curtains,822.1,Agimba,Jermain McCallum,jmccallumhk@answers.com,973-900-5208,88470 Nobel Way,Gamay,,6422,7606,Trilith,2945 Emmet Lane,Vazhiny,,187742,425-433-0826
48,SLKTING,soft and nice against your child's skin. The lyocell,Door tag,973.01,Fanoodle,Georgeanne Pinnere,gpinnere1b@spiegel.de,807-847-2926,32 Hansons Pass,Žihle,,331 65,6875,Realmix,7621 Fremont Crossing,Capioví,,3334,692-141-2407
130,PAX,so the plant can draw out moisture when needed. View more product information Each basket is woven by hand and is therefore unique. View more product information The lamp has got double function - you can use it as a clamp spotlight or assemble it on the wall as a wall lamp. View more product information The blind lowers the general light level and provides privacy by preventing people outside from seeing directly into the room. View more product information View more product information Of course your home should be a safe place for the entire family. Thats why a safety fitting is included so that you can attach the chest of drawers to the wall. Becomes a practical shelf for small things when folded down. View more product information View more product information Solid wood is a durable natural material. Light bulb sold separately. IKEA recommends LED bulb E27 600 lumen globe opal white. View more product information You can easily wirelessly charge your smartphone,Soft toy,673.59,Yozio,Dorris Spain,dspain3l@zdnet.com,820-755-5830,95261 Gina Park,Krupka,,417 41,6614,Blogspan,46 Columbus Circle,Älvsjö,AB,125 71,457-474-6951
61,MERETE,for easy assembly. View more product information The ladder mounts on the right or the left side of the bed. Cotton satin with high lustre feels soft against the skin. Cotton,Soft toy,487.49,Topicstorm,Bianka Birdall,bbirdall1o@amazon.co.jp,712-300-9845,12 Moland Street,Bambang,,3702,9100,Jabbercube,84531 Mifflin Terrace,Molsheim,C1,67124 CEDEX,475-671-5555
124,RARING,simple lines make it easy to combine with many styles of furniture. Of course your home should be a safe place for the entire family. Thats why a safety fitting is included so that you can attach the chest of drawers to the wall. View more product information Out of wall space? Dont worry,Soft toy,855.43,DabZ,Holly Coule,hcoule3f@thetimes.co.uk,767-322-4549,5 Pine View Road,Athmuqam,,12071,5749,Edgepulse,9 Clyde Gallagher Center,Fauske,18,8206,111-136-3832
989,ADILS,to fit in the space available. Pre-drilled holes for legs,Wardrobe,778.76,Eare,Kahlil Cawkill,kcawkillrg@accuweather.com,665-236-7795,2 Moland Place,Aurora,,7020,1210,Divanoodle,05 Twin Pines Junction,Haninge,AB,136 63,947-949-0840
452,STRMBY,picture of a pet or favourite band and creates a personal and cosy atmosphere in the room. View more product information This decorative lighting chain with coloured balls in different sizes creates a unique atmosphere in the room. View more product information The textile shade provides a diffused and decorative light. The adjustable shelf is extra heat- and impact-resistant and has a high load-bearing capacity since it is made of tempered glass. Bathroom mixer tap is sold separately. View more product information Smooth-running and soft-closing drawers with pull-out stop. 10 year guarantee. Read about the terms in the guarantee brochure. View more product information Gives a diffused light; good for spreading light into larger areas of a bathroom. Helps you organise detergent or soap at the sink bowl,Wardrobe,996.43,Rhybox,Tessy Goncalo,tgoncalocj@upenn.edu,627-466-3212,69680 Oneill Plaza,Opinogóra Górna,,06-406,323,Babbleopia,881 Twin Pines Drive,Shimoda,,886-0112,391-330-5012
889,VANDRING RV,sold separately. View more product information The OMLOPP spotlight brightens up the inside of your cabinets and makes it easy to see and find what you need. Drip-free spout which makes it easier to pour without spilling. View more product information The round shape gives you a generous table top for trays,low pile,26.33,Zoomdog,Gene Draycott,gdraycottoo@wix.com,982-417-5699,4659 Merrick Alley,Juntas,,11803,6664,Wikizz,346 Bashford Center,Pamyat’ Parizhskoy Kommuny,,606488,616-181-9981
882,LILLABO,oil and vinegar close at hand with this hanging tray. You can choose how you want to use this basket  turned up with handles or turned down to display the contents. View more product information Can be hung horizontally or vertically to fit in the space available. The solid pine shows off the attractive grains and beauty mark knots that give each unique piece its own naturally grown,set of 2,235.56,Skimia,Fidel Longden,flongdenoh@utexas.edu,165-862-3959,8636 Warner Trail,Hostomice,,417 52,7573,Camimbo,57883 Sage Terrace,Saint-Quentin-en-Yvelines,A8,78093 CEDEX 9,771-236-0521
573,VSTANBY,muted colours and matt glaze,set of 9,928.08,Oyonder,Felecia Sibley,fsibleyfw@utexas.edu,920-732-6172,74412 Florence Street,Žirovnice,,394 68,5153,Einti,1 Haas Crossing,Baratã,11,2725-191,227-777-8105
520,AVSKILD,decorative look and extra warmth and comfort for you. View more product information You can easily adjust the height to suit your needs as the clothes rack can be locked in place at 6 fixed levels. The rug is super soft,Footstool,221.92,Digitube,Sean Oscroft,soscroftef@cafepress.com,303-331-3988,0286 Caliangt Circle,Barranqueras,,3480,3330,Devshare,0 Kings Point,Raduzhnyy,,601380,672-100-8821
825,VEJMON,m). Anti-slip cover on top reduces the risk of slippage. Practical storage space under the lid for bath toys,Fridge A+,26.82,Rhycero,Alexander Portugal,aportugalmw@linkedin.com,863-640-6662,9 Stuart Terrace,Spasskoye-Lutovinovo,,303002,2175,Reallinks,948 Blue Bill Park Hill,Boleiros,14,2495-313,401-488-6427
196,GODMORGON,which makes the bowl durable and extra resistant to impact. Made of bamboo,Plant pot,455.74,Buzzshare,Carol Ogilvy,cogilvy5f@scribd.com,383-634-6361,591 Annamark Parkway,Santi Suk,,61150,8862,Quimm,4 Delaware Lane,Austin,TX,78726,512-625-1680
65,HNGA,youll see that the stripes arent completely straight  thats because the designer has painted them by hand. Interior accessories  that help you organise inside your wardrobe are sold separately. View more product information 10 year guarantee. Read about the terms in the guarantee brochure. Made of cotton and lyocell,Wall lamp,656.79,Thoughtworks,Karole Torbet,ktorbet1s@barnesandnoble.com,332-359-2299,97246 Buell Trail,Binguang,,5400,8109,DabZ,254 Green Ridge Trail,Salinas,,1656,336-838-9589
309,FORMAT,which is very effective at cleaning and removing stubborn dirt,Work lamp,364.55,Meezzy,Celia Shilstone,cshilstone8k@netlog.com,775-620-9486,6381 Nobel Park,Sultan Kudarat,,4436,5362,Quire,4857 Banding Center,Adelaide,,5760,176-925-8245
464,KOMPLEMENT,thanks to the depth of the frame. View more product information The mirror comes with safety film on the back,flatwoven,198.64,Fliptune,Elberta Grigorushkin,egrigorushkincv@weather.com,444-722-4209,1 Mayfield Pass,Dulian,,3110,9166,Jabbersphere,167 Helena Avenue,Solec Nad Wisłą,,80-201,485-506-2365
661,DIODER,with varying grain patterns and shifts in colour that highlight the natural charm of wood. It brings the feeling of tradition,flatwoven,905.8,Einti,Emmalee Ginley,eginleyic@time.com,244-389-2735,85865 Kinsman Pass,Hayama,,999-3242,3541,Browsebug,8568 Grayhawk Junction,Balboa,,662017,218-976-6540
329,GULLREGN,low and straight shape which makes it perfect for all types of cold drinks,high pile,276.02,Zoomcast,Vachel Goney,vgoney94@google.co.uk,460-857-8353,469 Brentwood Junction,Buesaco,,520518,7303,Jatri,91958 Dunning Plaza,Bayonne,97,64109 CEDEX,985-353-9226
240,VRVIND,connect two FINTORP rails together using only one bracket. RIKTIG draw rod is sold separately. View more product information May help you reduce heating costs as the air inside the honeycomb structure creates a layer of insulation. View more product information Handwoven by skilled craftspeople,Bath towel,846.37,Jayo,Fayth Schoffler,fschoffler6n@parallels.com,323-358-0140,72983 Pine View Place,Apoya,,2304,2113,Quimm,45 Eagle Crest Lane,Tamnag,,9803,783-270-2285
