product_id,product_name,product_description,product_category,product_price,supplier_name,supplier_contact,supplier_email,supplier_phone_number,supplier_street_address,supplier_city,supplier_state,supplier_zip_code,stock_quantity,store_name,store_address,store_city,store_state,store_zip_code,store_phone_number
113,NOJSIG,as it has a spring mechanism that keeps it firmly in place. Ultra soft,Quilt cover and pillowcase,559.93,Twiyo,Manfred Bellison,mbellison34@nba.com,585-873-3278,4070 Pennsylvania Way,Camaquã,,96180-000,2776,Voolith,5 Vidon Junction,Gaozhou,,,912-341-4959
809,KLABB,to fit in the space available. You can personalise your home with artwork that expresses your style. Motif created by Joni Whyte. Cotton,Wall mounted extractor hood,971.39,Yambee,Smitty Addlestone,saddlestonemg@marketwatch.com,825-570-6314,7021 East Parkway,Buenavista,,8601,7500,Dablist,7 Hanover Point,Velagići,,,938-450-8231
646,VGGIS,a hygienic,Quilt cover and 2 pillowcases,253.65,Rhyloo,Dorena Utting,duttinghx@ox.ac.uk,677-709-7200,36 Del Sol Hill,Chatan,,904-0116,3921,Tazzy,814 Kipling Hill,Mujiangping,,,732-374-0150
147,BLVIK,natural feeling to your room View more product information Untreated solid wood is a durable natural material which is even more hardwearing and easy to look after if you oil or wax the surface. View more product information Made of solid wood,Quilt cover and 4 pillowcases,444.7,Jaxspan,Marco Harsent,mharsent42@china.com.cn,215-332-1697,012 Corscot Street,Sannikovo,,658059,4527,Avamba,2433 Saint Paul Way,Novopokrovka,,,828-178-4802
294,NORDLI,free-standing fridge that fits easily into kitchens of all sizes. Storage box sold separately. View more product information Cover made of extra hard-wearing polyester with a quilted,Quilt cover and 4 pillowcases,854.69,Npath,Katie Santarelli,ksantarelli85@multiply.com,694-416-3664,33 Coolidge Way,Chazón,,2675,819,Meembee,66192 Meadow Vale Street,Masaran,,,598-253-1515
490,BLANDA MATT,both horizontally and vertically,Quilt cover and 4 pillowcases,83.51,Jayo,Gretna Prop,gpropdl@narod.ru,181-720-6572,41007 Buell Lane,Tiraspol,,MD-3300,7724,Einti,03 Mallard Plaza,Jinpanling,,,791-186-6217
466,ANSLUTA,absorbent and quick to dry since it's made of microfibre. Two-sided woven polyester which gives a soft fall and a decorative pattern on both sides. View more product information Easy to refill as the dispenser has a wide opening. Creates atmosphere with a pleasant scent of blossoming romance and warm candlelight. Lifelike artificial plant that remain just as fresh-looking year after year. Bathroom mixer tap is sold separately. GODMORGON legs are sold separately. Please note that a silicone kit and a jigsaw are needed to attach the wash-basin to the countertop. Sold separately. 10 year guarantee. Read about the terms in the guarantee brochure. A terry towel in medium thickness that is soft and highly absorbent (weight 500 g,Quilt cover and 4 pillowcases,561.14,Skivee,Calhoun Dinneen,cdinneencx@salon.com,593-986-4825,301 Mandrake Alley,Smolensk,,214501,7458,Edgeify,7638 5th Point,Kugri,,,413-799-5077
433,ENTRERTT,especially since they last up to 25,Bedspread and 2 cushion covers,43.16,Avavee,Isidoro Byllam,ibyllamc0@twitter.com,859-335-9569,29 Sauthoff Place,Slovenska Bistrica,,2310,7273,Oba,7 Sachtjen Drive,Muang Pakxan,,,359-675-4564
341,KUGGIS,which means it blocks 96% of the ultraviolet radiation. View more product information Protects the surface and adds a transparent finish,Bedspread and 2 cushion covers,697.34,Ntags,Fred Logue,flogue9g@google.co.uk,593-444-8948,441 Cody Park,Perm,,614097,3623,Topicshots,95604 Johnson Point,Shofirkon,,,873-980-7094
772,EKESTAD,plays on it. Practical storage for all small things. Gives good support when reading or playing computer games. View more product information You can easily direct the light where you want it because the lamp arm and head are adjustable. Easy to keep clean since the cover can be machine washed. All soft toys are good at hugging,Ceiling spotlight with 5 spots,414.27,Kazu,Goldie Claasen,gclaasenlf@guardian.co.uk,141-104-0290,05134 Oak Street,Borovichi,,174420,2820,Vinder,863 Jay Alley,Nusaherang,,,127-100-8433
156,SPELPLAN,decorative look and extra warmth and comfort for you. View more product information You can easily adjust the height to suit your needs as the clothes rack can be locked in place at 6 fixed levels. The rug is super soft,Childrens apron with chefs hat,240.65,Shufflester,Monroe Bent,mbent4b@lulu.com,201-843-4729,543 Springview Trail,San Vicente,,11401,6162,Photospace,406 Bunting Avenue,Boujniba,,,832-493-6309
733,HYTTAN,a seat or stand on it to reach things that are stored higher up. Cotton,LED 4-piece lighting strip set,495.82,Devcast,Sid Cicerone,sciceronekc@soundcloud.com,887-813-5855,776 Longview Road,Marull,,5139,6775,Vinte,9 Orin Park,Tsapêraī,,,812-301-3175
552,NORSBORG,a hardwearing natural material that can be sanded and surface treated when required. View more product information Solid pine is a natural material which ages beautifully and gains its own unique character over time. Handwoven; each piece of furniture is unique. View more product information The cushion cover is made of ramie,Single-lever kitchen mixer tap,9.1,Jabbercube,Pooh Johantges,pjohantgesfb@linkedin.com,208-506-5638,65 Fremont Parkway,Svetlyy Yar,,404170,1870,Jabbersphere,6378 Mockingbird Trail,Jalasenga,,,116-551-1543
263,FRIHETEN,because the chair can be easily adjusted to 5 different heights  38,Wash-basin cabinet with 2 doors,230.45,Skipfire,Karole Fraine,kfraine7a@mayoclinic.com,936-700-4997,97503 Vera Parkway,Villa Regina,,8336,6326,Photobug,494 Mitchell Way,Jeong,,,829-639-2910
792,ERSTTA,which is a hardwearing and warm natural material. View more product information If you look closely,Base cabinet with doors and drawer,381.87,DabZ,Albertine Betham,abethamlz@mediafire.com,302-663-0373,328 Coleman Street,Viejo Daan Banua,,6119,7775,Ailane,43044 Huxley Center,San Pedro de Ycuamandiyú,,,937-538-4843
239,SVENSKR,smooth texture. View more product information Feels soft against your skin and retains its vivid colours for a long time since the yarn is dyed before weaving. Suitable for both indoor and outdoor use. Hinges are sold separately. View more product information HITTARP door has a soft off-white colour and vertical groove pattern that give a sense of traditional craftsmanship and create a personal kitchen with warm country charm. View more product information For a longer rail,Wsh-stnd w countertop 45 wsh-basin,43.78,Yakidoo,Appolonia Harwood,aharwood6m@instagram.com,208-599-3492,73 Emmet Lane,Fastovetskaya,,352101,768,Bubblemix,09 Daystar Court,Liopétri,,,268-252-5627
157,STORABO,warm and cosy. Ideal on the floor or draped across your favourite armchair. Provided with safety film - reduces damage if glass is broken. View more product information Concealed press studs keep the quilt in place. The dense,5-p serving stand with cupcakes set,817.73,Jaxspan,Matteo Wadmore,mwadmore4c@wired.com,222-388-6493,8 Fulton Alley,Komga,,4950,952,Yodo,796 Judy Street,Xiaojing,,,292-485-5539
103,SRBAR,m). 10 year guarantee. Read about the terms in the guarantee brochure. View more product information Seagrass has natural colour variations which makes every basket unique. View more product information Flexible; can be mounted with the light turned downwards or upwards. View more product information Collecting newspapers,Bed frm w headboard+slatted bd base,628.66,Skiba,Junie Sired,jsired2u@ning.com,872-819-3964,38 American Ash Circle,Itapemirim,,29330-000,1124,Tagtune,527 Columbus Plaza,Kikinda,,,732-812-6481
276,VINNA,for easy assembly. View more product information View more product information Perfect for everything from newspapers to clothes. 5 year guarantee. Read about the terms in the guarantee brochure. 5 year guarantee. Read about the terms in the guarantee brochure. View more product information 5 year guarantee. Read about the terms in the guarantee brochure. 25 year guarantee. Read about the terms in the guarantee brochure. Hinges are sold separately. Personalise your kitchen in a fun and easy way by adding one or more colourful accent doors. Hinges are sold separately. View more product information RINGHULT kitchen door has clean,set of 4,111.31,Jaxbean,Rich Avramov,ravramov7n@yandex.ru,401-160-2630,42 Tennessee Place,Uppsala,C,753 81,7809,Photobean,33 Spohn Avenue,Selebi-Phikwe,,,305-884-0851
211,LILLNGEN,as knots and other marks remain on the surface. Protects the table top surface and reduces noise from plates and cutlery. The melamine table top is moisture resistant,Soap dispenser,20.06,Einti,Michal Fancutt,mfancutt5u@cyberchimps.com,111-463-4706,2 Leroy Lane,Jönköping,F,555 94,2399,Plajo,27595 Helena Road,Tuanchengshan,,,893-235-2864
692,FLDIE,etc. helps you keep your things organised and the table top clear. The glass has a simple,Wall shelf,93.65,Tavu,Kalila Portman,kportmanj7@berkeley.edu,800-333-8148,5 Banding Way,Göteborg,O,416 55,8774,Fatz,7 High Crossing Drive,Ma’an,,,797-815-3712
304,TUSENSKNA,with simple straight lines that let the wood pattern steal the show. Oak sets a warm,Sheer curtains,832.53,Babbleset,Egan Brightman,ebrightman8f@toplist.cz,447-583-6755,69 Golden Leaf Junction,Västra Frölunda,O,426 71,7562,Buzzshare,9 Evergreen Point,Krajan Dua Sumbersari,,,397-694-7047
892,HJRTEVN,feels soft and nice against your skin. These brushed stainless-steel knobs give a modern touch to your kitchen. You sit comfortably thanks to the armrests. View more product information The high pile dampens sound and provides a soft surface to walk on. View more product information You can easily charge your smartphone wirelessly. If your phone supports wireless charging,Cabinet,842.01,Topiczoom,Persis Kinzel,pkinzelor@apple.com,764-560-6043,32 Brickson Park Point,Karlstad,S,651 80,3556,Twitterbeat,89812 American Road,Haquira,,,729-470-7375
756,FALSTERBO,comforting and listening and are fond of play and mischief. In addition,Inset sink,241.33,Leexo,Eleanore Cristofalo,ecristofalokz@cafepress.com,502-110-6180,231 Tomscot Point,Karlstad,S,652 22,412,Flipopia,8 Corscot Crossing,Dharān Bāzār,,,153-759-7944
505,VRARYD,cotton blend absorbs and draws moisture away from your body and keeps you dry all night long. The zipper makes the cover easy to remove. Extra soft since the bedspread is padded. View more product information You can easily direct the light where you want it because the lamp arm and head are adjustable. Ideal for orchids,Bed storage box,313.94,Voolith,Hartley Gercke,hgerckee0@indiegogo.com,792-411-1095,57064 Fulton Street,Karlstad,S,651 11,5811,Einti,849 Helena Alley,Jiading,,,863-770-0262
907,SKRAMMEL,densely woven from fine yarn. View more product information View more product information You can put things like magazines and toys in the storage space under the seat. The gentle rocking helps your body and mind to relax. View more product information Extra covers to alternate with mean it's easy to give both your sofa and room a new look. Solid wood is a durable natural material. View more product information Can be hung horizontally or vertically. Plastic feet protect your floor against scratching. View more product information Create your own personalised pendant by combining the lamp shade with your choice of cord set. View more product information You can easily direct the light where you want it because the lamp arm and head are adjustable. View more product information Sateen-woven bedlinen in lyocell,set of 3,109.89,Mynte,Der Amner,damnerp6@ebay.co.uk,173-156-5868,9 Manley Avenue,Västerås,U,724 63,3553,Kamba,3570 Longview Street,Jiufeng,,,266-718-6348
709,ARV BRLLOP,outdoor use when re-staining the furniture,Desk,264.45,Teklist,Cosme Loy,cloyjo@deviantart.com,576-881-3759,35854 Ridgeway Pass,Ribeiro,01,4520-712,2574,Fivespan,8 Sundown Trail,Xiheshan,,,455-678-9887
434,EKTORP,000 hours. Your children will most likely outgrow their fear of the dark before the lights go out. Motif created by Zoe Ingram. All soft toys are good at hugging,Cushion cover,974.35,Roombo,Bertrand Faithfull,bfaithfullc1@prlog.org,566-750-6704,241 Loeprich Pass,São Mamede,01,3700-585,7757,Meeveo,6146 Harper Court,Langtang,,,947-727-8539
492,KRYDDIG,scarves or other accessories. View more product information The lamp has got double function - you can use it as a clamp spotlight or assemble it on the wall as a wall lamp. The sheer curtains let the daylight through but provide privacy so they are perfect to use in a layered window solution. Can be hung horizontally or vertically. View more product information You can either hang the lamp close to the ceiling in your living room or low over a coffee table. To be completed with ANSLUTA electronic transformer and ANSLUTA power supply cord,Mattress for extendable bed,651.58,Tazzy,Coop Juste,cjustedn@lycos.com,963-562-1899,79159 Kensington Terrace,Esmoriz,01,3885-395,1984,Ozu,55 Barnett Lane,Kribi,,,664-745-5804
921,GOSIG GOLDEN,for easy assembly. Solid wood is a hardwearing natural material. Easy to move thanks to the hole in the seat. View more product information 3 adjustable glass shelves; adjust spacing according to your own storage needs. Dinnerware that combines a simple,outdoor,221.75,Meetz,Alvin Yitzowitz,ayitzowitzpk@patch.com,124-564-0613,38 Nancy Plaza,Winschoten,04,9674,6585,Eadel,03 Straubel Way,Tailing,,,233-848-5331
554,BILD,traditional Persian pattern. View more product information You can fold the chair,Two-seat sofa-bed,602.01,Mydo,Shirleen Jerdon,sjerdonfd@bravesites.com,898-677-0872,70 Bowman Street,Teixoso,05,6200-595,2891,Yakitri,73 Mayfield Street,Anseong,,,351-264-2854
839,VINDALS,as the cabinet opens by sliding it to the side. 10 year guarantee. Read about the terms in the guarantee brochure. The unique shape makes the vases beautiful both with and without flowers. Easy to move - castors included. One side with magnifying mirror glass. One side with magnifying mirror glass. Perfect in a small bathroom since the wash-basin cabinet is shallow. Bathroom mixer tap is sold separately. GODMORGON legs are sold separately. 10 year guarantee. Read about the terms in the guarantee brochure. Tempered glass - extra resistant to heat,Handle,949.84,Muxo,Brigida Pabel,bpabelna@shutterfly.com,875-430-4476,6 Manufacturers Circle,Dongen,06,5104,340,Camimbo,7857 Barby Junction,Krajan,,,667-379-6054
909,PJTTERYD,and has a pronounced lustre that makes it look beautiful on your bed. Light bulb sold separately. IKEA recommends LED bulb E27 400 lumen globe opal white. View more product information The height is adjustable to suit your lighting needs. A durable mattress that can be used for a longer period of time. Fits big as well as small hands. The airy construction makes the moisture disappear. The fleece throw feels soft against your skin and can be machine washed. This pillow has less filling and is suitable if you like to sleep on a softer pillow. View more product information If you often feel cold and need extra warmth,Tea towel,627.66,Mybuzz,Henriette McCrackan,hmccrackanp8@utexas.edu,493-505-3928,1614 Russell Alley,Veghel,06,5464,6277,Yodoo,963 Dawn Park,Peristerá,,,100-816-4868
680,BEJUBLAD,so you can customise your storage as needed. View more product information Can be used individually or be pushed together to save space. View more product information Adjustable shelves; adapt space between shelves according to your needs. Shade is sold separately. View more product information As the light can be dimmed,Rug,222.75,Zoozzy,Sacha Itzkowicz,sitzkowicziv@t.co,971-115-0511,992 Eagle Crest Point,Ameixoeira,10,2425-702,8781,Teklist,6 Heffernan Place,Longquan,,,501-178-0475
881,BERTA RUTA,spices,Nest of tables,230.71,Riffpath,Lynnett Heyfield,lheyfieldog@ox.ac.uk,656-199-3493,909 Westend Crossing,Carreira,10,2425-254,2630,Skalith,2729 Judy Pass,Xinpu,,,922-495-4868
503,RISTINGE,scarves or handbags and a removable tray on top for your watch,Sprung mattress,469.01,Flipbug,Judy Blissitt,jblissittdy@hao123.com,662-627-9049,90538 Truax Hill,Carreira,10,2425-254,5846,Zooxo,807 Straubel Way,Machachi,,,628-485-5218
345,LISABO,outdoor use when re-staining the furniture,Chair,334.02,Jetwire,Jaquelin Errett,jerrett9k@weebly.com,393-765-1569,77054 Nova Alley,Trajouce,11,2785-041,5757,Twitterlist,73 Coolidge Street,Taoxi,,,548-731-8767
92,SLINGRIG,absorbent and quick to dry since it's made of microfibre. You can move the shelf and adjust the spacing according to your personal needs. View more product information The included water trap is easy to connect to the drain,Rug,65.05,Zoomlounge,Kennie Pritty,kpritty2j@quantcast.com,101-388-9560,2 Hovde Hill,Benavila,12,7480-205,2378,Dabvine,38461 Bartelt Crossing,Yuping,,,135-892-1554
234,LUNDSKR,soft,Bath mat,370.63,Rhynyx,Alanna Croix,acroix6h@oracle.com,283-400-0205,8 Eggendart Road,Castelo de Vide,12,7320-105,8186,Bubbletube,909 Kensington Place,Zargarān,,,973-893-3185
450,RDTOPPA,plays on it. View more product information The clock has a blackboard face,flatwoven,526.39,Thoughtbeat,Nikkie Grimes,ngrimesch@surveymonkey.com,225-306-1199,7 Debs Road,Vila Nova de Gaia,13,4400-005,7005,Tagfeed,8728 Thackeray Place,Chengxi,,,712-378-3235
650,MOLTE,then unhook and bring to the table or cooking pot for fresh herbs with every meal. Thick base with one layer of aluminium between two layers of stainless steel. Gives an even and energy-efficient heat,Cellular blind,333.95,Youspan,Sella Ferminger,sfermingeri1@1688.com,780-765-5966,83 Norway Maple Plaza,Lamoso,13,4590-416,6264,Skimia,373 Southridge Junction,Bandar-e Lengeh,,,362-734-2216
805,NOLMYRA,self-adhesive backing or screws. High-quality density foam will keep the chair comfortable for many years to come. View more product information Concealed storage under the seat. Cotton,Kitchen mixer tap,165.99,Tagpad,Orion Balcombe,obalcombemc@yandex.ru,118-261-0007,02583 Arizona Junction,Torre,13,4605-169,5644,Mymm,72 Badeau Court,Longnawang,,,894-814-3945
486,SNDRUM,cosy atmosphere in your home with a textile shade that spreads a diffused and decorative light. Shade is sold separately. View more product information The long,Mirror,219.87,Feedfish,Estevan Millan,emillandh@ucla.edu,130-296-7375,186 Emmet Terrace,Almada,15,2800-011,3816,Skinix,58881 Westerfield Pass,Banja Luka,,,970-462-6420
209,GUNNERN,muted colours and matt glaze,Mirror,426.52,Feedfish,Culley Strauss,cstrauss5s@ebay.co.uk,132-658-4524,360 Heath Park,Calçada,16,4930-345,94,Kwideo,37 Bonner Junction,Potongan,,,221-699-3091
784,DAGARN,they are reliable and tested for safety. Made of cotton and lyocell,Gas hob,288.59,Kazio,Lisha Yoselevitch,lyoselevitchlr@1688.com,795-870-9247,0 Tony Point,Porta,16,4940-352,1623,Dynabox,80 Summit Drive,Tuochuan,,,690-360-8338
123,PHITTIG,slender shelves give the shelving unit a light and airy look. And the clean,Soft toy,851.47,Blogpad,Ashbey Caley,acaley3e@deviantart.com,793-897-1966,61882 Schurz Trail,Pedra,16,4980-782,4161,Gabtype,6 Pierstorff Drive,Sixi,,,351-649-1635
945,CHARMTROLL,to suit the style of your kitchen. View more product information 25 year guarantee. Read about the terms in the guarantee brochure. Ideal for your basic everyday cooking. View more product information Made of enamelled steel,LED lighting chain with 48 lights,795.11,Zooveo,Althea Kilty,akiltyq8@list-manage.com,757-524-1288,67106 Rutledge Court,Bodø,18,8010,4397,Meeveo,2766 Elmside Hill,Hariang,,,563-169-8773
765,BARKABODA,soft and nice against your child's skin. The flat-woven pattern is visible on both sides which makes the rug reversible. View more product information The picture ledge has a special groove to keep smaller frames at the perfect angle. The cushion is soft to hug and big enough to use as back support when reading or playing. A bed canopy gives privacy and creates a room-in-room feeling. Cotton,Highchair with safety belt,568.85,Photobug,Cordell Keer,ckeerl8@technorati.com,872-330-7180,8506 Sachs Lane,Harstad,19,9414,6923,Demizz,6895 Melrose Hill,Cikembang,,,795-122-8265
718,GLITTRAN,min. size 30x30 cm,Noticeboard,835.86,Quinu,Elysee Raddan,eraddanjx@eepurl.com,587-216-5953,8580 Tennessee Parkway,Santo Amaro,45,9800-325,4805,Browsecat,1430 Sutherland Alley,Masachapa,,,931-551-2422
132,FRHJA,space and need. View more product information Easy to transport and store since the packaging also functions as a storage bag. The polyester filling holds its shape and gives your body soft support. View more product information Durable,Wall lamp,544.04,Fiveclub,Sidney Murrells,smurrells3n@infoseek.co.jp,460-608-3472,20 Buena Vista Avenue,Bordeaux,97,33733 CEDEX 9,398,Linktype,995 Mallory Road,Yuanyang Zhen,,,759-785-2989
308,UNDREDAL,you can just hang it up with the hook underneath on a door or in the wardrobe. View more product information The string mop and cloths are made of microfibre,LED cabinet lighting,288.63,Topiczoom,Hamlin Stebles,hstebles8j@facebook.com,564-311-6501,06916 Rusk Circle,Cherbourg-Octeville,99,50109 CEDEX,5841,Yombu,1493 Lerdahl Road,Bacem,,,751-902-9541
425,NORNS,for easy assembly. View more product information The ladder mounts on the right or the left side of the bed. Cotton satin with high lustre feels soft against the skin. Cotton,Rug,460.73,Dynazzy,Bertie Gadney,bgadneybs@bloglines.com,746-181-7544,78 Fairfield Pass,Saint-Claude,A6,39209 CEDEX,2933,Realblab,70 Mccormick Hill,Chiguayante,,,495-306-3218
715,BITTERGURKA,KLASEN charcoal barbecue,Table with drawers,59.29,Dabjam,Chrysler Vigar,cvigarju@blogger.com,738-443-5793,8193 John Wall Park,Besançon,A6,25024 CEDEX,3969,Nlounge,50423 Hallows Court,Kaka,,,675-437-4809
774,VRDERA,they are reliable and tested for safety. Extendable,Door,535.8,Avavee,Donal Feehily,dfeehilylh@surveymonkey.com,807-479-9865,36 Tomscot Street,Paris 17,A8,75832 CEDEX 17,4425,Brainbox,66 Eliot Place,Baruunturuun,,,569-567-2572
423,BEGRLIG,they are reliable and tested for safety. Made from 100% cotton,Knob,857.54,Skippad,Jory Wycliffe,jwycliffebq@chronoengine.com,266-688-1652,5354 Thierer Drive,Cergy-Pontoise,A8,95652 CEDEX,3279,Oloo,118 Becker Circle,Sukaraharja,,,684-196-5720
475,PERSISK KELIM GASHGAI,as the cabinet opens by sliding it to the side. 10 year guarantee. Read about the terms in the guarantee brochure. The unique shape makes the vases beautiful both with and without flowers. Easy to move - castors included. One side with magnifying mirror glass. One side with magnifying mirror glass. Perfect in a small bathroom since the wash-basin cabinet is shallow. Bathroom mixer tap is sold separately. GODMORGON legs are sold separately. 10 year guarantee. Read about the terms in the guarantee brochure. Tempered glass - extra resistant to heat,1 door,688.2,Gabtune,Chucho Presnell,cpresnelld6@dagondesign.com,259-996-0844,31933 Vera Avenue,Versailles,A8,78014 CEDEX,9775,Mydo,5 Derek Circle,Tianta,,,376-137-4116
87,BOLLTOKIG,so you can write or draw pictures of activities next to the hours to help your child learn about time. View more product information KNOPPARP sofa is very durable thanks to the metal construction and strong supporting fabric. View more product information This frame puts a decorative ring of light around your childs latest diploma,Cushion,263.93,Plambee,Lida Anfossi,lanfossi2e@soup.io,816-138-5605,4336 Shasta Drive,Neuilly-sur-Seine,A8,92521 CEDEX,2910,Dazzlesphere,0 Oak Valley Terrace,Binagadi,,,580-839-6686
883,STUVA,individual personality. View more product information Concealed press studs keep the quilt in place. Each box is unique since it is handmade. Mattress and bedlinen are sold separately. View more product information 17 slats of layer-glued birch adjust to your body weight and increase the suppleness of the mattress. View more product information This woven cotton bedspread gives your bed a vibrant,Bookcase,930.73,Jabbersphere,Hilliary Le Gall,hleoi@youku.com,727-193-3912,6 Mcbride Park,Gennevilliers,A8,92622 CEDEX,4967,Flashset,604 Forest Place,Byerazino,,,243-962-8608
596,HRFIN,because the shelf is adjustable. 25 year guarantee. Read about the terms in the guarantee brochure. These white knobs are easy to grip with your fingers and smooth to the touch,Plant pot,687.02,Flashset,Novelia Southby,nsouthbygj@bing.com,844-515-1250,3 Norway Maple Pass,Paris 14,A8,75675 CEDEX 14,1598,Innojam,600 Burning Wood Way,Chambara,,,777-362-3214
538,LAGAN OV3,photos and other keepsakes. View more product information Gives decorative patterns on the ceiling and on the wall. The rug is perfect for outdoor use since it is made to withstand rain,Deep plate,653.56,Avaveo,Howard Wickrath,hwickrathex@zimbio.com,302-786-2033,51 Hoffman Alley,Le Perreux-sur-Marne,A8,94174 CEDEX,7309,Kamba,0 Shopko Avenue,Rupe,,,220-951-9078
949,DUM,without leaning the head back. View more product information Gives a soft mood light. View more product information The melamine table top is moisture resistant,Wood stain,751.63,Digitube,Graehme Burbidge,gburbidgeqc@squidoo.com,794-593-3864,25860 Namekagon Trail,Rungis,A8,94518 CEDEX 1,3939,Realbuzz,56 Kenwood Pass,Lüderitz,,,555-139-2350
997,LTTSAM,thanks to the three different heights. The thick pile dampens sound and provides a soft surface to walk on. You can have fun colouring and personalising each building any way you like. Your child can showcase their art creations,pillowcase for cot,748.69,Einti,Irene Kellen,ikellenro@oakley.com,873-466-5696,74211 New Castle Pass,Ivry-sur-Seine,A8,94857 CEDEX,8814,Quinu,3662 Atwood Road,Knyazhichi,,,483-333-1668
