product_id,product_name,product_description,product_category,product_price,supplier_name,supplier_contact,supplier_email,supplier_phone_number,supplier_street_address,supplier_city,supplier_state,supplier_zip_code,stock_quantity,store_name,store_address,store_city,store_state,store_zip_code,store_phone_number
169626,volutpat eleifend donec ut dolor morbi vel lectus in quam fringilla rhoncus mauris,"In quis justo. Maecenas rhoncus aliquam lacus. Morbi quis tortor id nulla ultrices aliquet. Maecenas leo odio, condimentum id, luctus nec, molestie sed, justo. Pellentesque viverra pede ac diam. Cras pellentesque volutpat dui. Maecenas tristique, est et tempus semper, est quam pharetra magna, ac consequat metus sapien ut nunc. Vestibulum ante ipsum primis in faucibus orci luctus et ultrices posuere cubilia Curae; Mauris viverra diam vitae quam. Suspendisse potenti.",Sports,268.61,Snaptags,,,,,,,,,,,,,,
971419,arcu sed augue aliquam erat volutpat in congue etiam justo etiam pretium iaculis justo in hac habitasse,"Duis aliquam convallis nunc. Proin at turpis a pede posuere nonummy. Integer non velit. Donec diam neque, vestibulum eget, vulputate ut, ultrices vel, augue. Vestibulum ante ipsum primis in faucibus orci luctus et ultrices posuere cubilia Curae; Donec pharetra, magna vestibulum aliquet ultrices, erat tortor sollicitudin mi, sit amet lobortis sapien sapien non mi. Integer ac neque. Duis bibendum. Morbi non quam nec dui luctus rutrum.",Sports,729.92,Edgetag,,,,,,,,,,,,,,
747501,etiam pretium iaculis justo in hac habitasse platea dictumst etiam,"Morbi non quam nec dui luctus rutrum. Nulla tellus. In sagittis dui vel nisl. Duis ac nibh. Fusce lacus purus, aliquet at, feugiat non, pretium quis, lectus. Suspendisse potenti. In eleifend quam a odio.",Sports,918.13,Brightdog,,,,,,,,,,,,,,
674578,est lacinia nisi venenatis tristique fusce congue diam id ornare imperdiet sapien urna,"Nam nulla. Integer pede justo, lacinia eget, tincidunt eget, tempus vel, pede. Morbi porttitor lorem id ligula. Suspendisse ornare consequat lectus. In est risus, auctor sed, tristique in, tempus sit amet, sem. Fusce consequat.",Sports,578.72,Geba,,,,,,,,,,,,,,
754136,dolor sit amet consectetuer adipiscing elit proin risus praesent lectus vestibulum quam,Nullam sit amet turpis elementum ligula vehicula consequat. Morbi a ipsum. Integer a nibh. In quis justo.,Sports,694.26,BlogXS,,,,,,,,,,,,,,
977333,cubilia curae donec pharetra magna vestibulum aliquet ultrices erat tortor sollicitudin,"Morbi sem mauris, laoreet ut, rhoncus aliquet, pulvinar sed, nisl. Nunc rhoncus dui vel sem. Sed sagittis. Nam congue, risus semper porta volutpat, quam pede lobortis ligula, sit amet eleifend pede libero quis orci. Nullam molestie nibh in lectus. Pellentesque at nulla. Suspendisse potenti. Cras in purus eu magna vulputate luctus. Cum sociis natoque penatibus et magnis dis parturient montes, nascetur ridiculus mus. Vivamus vestibulum sagittis sapien.",Sports,137.62,Kamba,,,,,,,,,,,,,,
761642,pede ac diam cras pellentesque volutpat dui maecenas tristique est et,Praesent blandit.,Sports,311.55,Feedbug,,,,,,,,,,,,,,
688387,posuere metus vitae ipsum aliquam non mauris morbi non lectus aliquam sit amet diam in magna bibendum imperdiet,"In est risus, auctor sed, tristique in, tempus sit amet, sem. Fusce consequat. Nulla nisl. Nunc nisl. Duis bibendum, felis sed interdum venenatis, turpis enim blandit mi, in porttitor pede justo eu massa. Donec dapibus. Duis at velit eu est congue elementum. In hac habitasse platea dictumst. Morbi vestibulum, velit id pretium iaculis, diam erat fermentum justo, nec condimentum neque sapien placerat ante. Nulla justo.",Sports,171.2,Demizz,,,,,,,,,,,,,,
317684,vivamus in felis eu sapien cursus vestibulum proin eu mi nulla ac enim in tempor turpis nec,"Morbi porttitor lorem id ligula. Suspendisse ornare consequat lectus. In est risus, auctor sed, tristique in, tempus sit amet, sem. Fusce consequat. Nulla nisl.",Sports,456.39,Zoozzy,,,,,,,,,,,,,,
916223,morbi quis tortor id nulla ultrices aliquet maecenas leo odio condimentum id luctus nec molestie sed justo pellentesque,"Maecenas leo odio, condimentum id, luctus nec, molestie sed, justo. Pellentesque viverra pede ac diam. Cras pellentesque volutpat dui. Maecenas tristique, est et tempus semper, est quam pharetra magna, ac consequat metus sapien ut nunc. Vestibulum ante ipsum primis in faucibus orci luctus et ultrices posuere cubilia Curae; Mauris viverra diam vitae quam. Suspendisse potenti. Nullam porttitor lacus at turpis. Donec posuere metus vitae ipsum. Aliquam non mauris. Morbi non lectus.",Sports,845.55,Blogtag,,,,,,,,,,,,,,
668492,quam suspendisse potenti nullam porttitor lacus at turpis donec posuere metus vitae,"Quisque erat eros, viverra eget, congue eget, semper rutrum, nulla. Nunc purus. Phasellus in felis. Donec semper sapien a libero. Nam dui. Proin leo odio, porttitor id, consequat in, consequat ut, nulla. Sed accumsan felis. Ut at dolor quis odio consequat varius.",Sports,606.65,Skynoodle,,,,,,,,,,,,,,
936441,ullamcorper augue a suscipit nulla elit ac nulla sed vel enim sit amet nunc viverra dapibus nulla suscipit ligula,Aliquam erat volutpat.,Sports,481.9,Jabberbean,,,,,,,,,,,,,,
451773,vulputate justo in blandit ultrices enim lorem ipsum dolor sit amet consectetuer adipiscing elit proin interdum mauris non ligula,Vivamus vel nulla eget eros elementum pellentesque.,Sports,149.02,Roodel,,,,,,,,,,,,,,
840234,justo eu massa donec dapibus duis at velit eu est congue elementum in hac habitasse platea dictumst morbi vestibulum,"Nullam orci pede, venenatis non, sodales sed, tincidunt eu, felis. Fusce posuere felis sed lacus. Morbi sem mauris, laoreet ut, rhoncus aliquet, pulvinar sed, nisl. Nunc rhoncus dui vel sem.",Sports,243.75,Skajo,,,,,,,,,,,,,,
834983,donec vitae nisi nam ultrices libero non mattis pulvinar nulla pede ullamcorper augue a suscipit nulla elit ac nulla,Integer tincidunt ante vel ipsum. Praesent blandit lacinia erat.,Sports,785.3,Skibox,,,,,,,,,,,,,,
15783,sapien cum sociis natoque penatibus et magnis dis parturient montes nascetur ridiculus mus etiam vel augue vestibulum rutrum rutrum,Mauris lacinia sapien quis libero. Nullam sit amet turpis elementum ligula vehicula consequat.,Sports,617.9,Buzzbean,,,,,,,,,,,,,,
311127,in eleifend quam a odio in hac habitasse platea dictumst maecenas ut massa quis augue luctus,Suspendisse potenti. In eleifend quam a odio. In hac habitasse platea dictumst. Maecenas ut massa quis augue luctus tincidunt. Nulla mollis molestie lorem. Quisque ut erat. Curabitur gravida nisi at nibh.,Sports,857.66,Realbuzz,,,,,,,,,,,,,,
507724,diam erat fermentum justo nec condimentum neque sapien placerat ante nulla justo aliquam quis turpis,"Mauris ullamcorper purus sit amet nulla. Quisque arcu libero, rutrum ac, lobortis vel, dapibus at, diam. Nam tristique tortor eu pede.",Sports,376.87,Aivee,,,,,,,,,,,,,,
589772,justo in hac habitasse platea dictumst etiam faucibus cursus urna ut tellus nulla ut erat id mauris vulputate,"Nunc nisl. Duis bibendum, felis sed interdum venenatis, turpis enim blandit mi, in porttitor pede justo eu massa. Donec dapibus. Duis at velit eu est congue elementum. In hac habitasse platea dictumst. Morbi vestibulum, velit id pretium iaculis, diam erat fermentum justo, nec condimentum neque sapien placerat ante. Nulla justo. Aliquam quis turpis eget elit sodales scelerisque. Mauris sit amet eros.",Sports,960.25,Pixope,,,,,,,,,,,,,,
964905,volutpat erat quisque erat eros viverra eget congue eget semper rutrum nulla nunc,"Donec dapibus. Duis at velit eu est congue elementum. In hac habitasse platea dictumst. Morbi vestibulum, velit id pretium iaculis, diam erat fermentum justo, nec condimentum neque sapien placerat ante. Nulla justo. Aliquam quis turpis eget elit sodales scelerisque. Mauris sit amet eros. Suspendisse accumsan tortor quis turpis. Sed ante.",Sports,381.05,Viva,,,,,,,,,,,,,,
945430,morbi ut odio cras mi pede malesuada in imperdiet et commodo vulputate justo in,"Sed ante. Vivamus tortor. Duis mattis egestas metus. Aenean fermentum. Donec ut mauris eget massa tempor convallis. Nulla neque libero, convallis eget, eleifend luctus, ultricies eu, nibh. Quisque id justo sit amet sapien dignissim vestibulum. Vestibulum ante ipsum primis in faucibus orci luctus et ultrices posuere cubilia Curae; Nulla dapibus dolor vel est. Donec odio justo, sollicitudin ut, suscipit a, feugiat et, eros.",Sports,379.19,Cogibox,,,,,,,,,,,,,,
95615,vehicula condimentum curabitur in libero ut massa volutpat convallis morbi odio odio elementum eu interdum eu tincidunt in leo maecenas,"In tempor, turpis nec euismod scelerisque, quam turpis adipiscing lorem, vitae mattis nibh ligula nec sem. Duis aliquam convallis nunc. Proin at turpis a pede posuere nonummy. Integer non velit. Donec diam neque, vestibulum eget, vulputate ut, ultrices vel, augue. Vestibulum ante ipsum primis in faucibus orci luctus et ultrices posuere cubilia Curae; Donec pharetra, magna vestibulum aliquet ultrices, erat tortor sollicitudin mi, sit amet lobortis sapien sapien non mi.",Sports,148.87,Zazio,,,,,,,,,,,,,,
53231,vestibulum ante ipsum primis in faucibus orci luctus et ultrices posuere cubilia,"Donec semper sapien a libero. Nam dui. Proin leo odio, porttitor id, consequat in, consequat ut, nulla. Sed accumsan felis. Ut at dolor quis odio consequat varius. Integer ac leo.",Sports,756.36,Fivespan,,,,,,,,,,,,,,
674689,in eleifend quam a odio in hac habitasse platea dictumst maecenas ut massa quis augue luctus tincidunt nulla,"Duis bibendum. Morbi non quam nec dui luctus rutrum. Nulla tellus. In sagittis dui vel nisl. Duis ac nibh. Fusce lacus purus, aliquet at, feugiat non, pretium quis, lectus. Suspendisse potenti. In eleifend quam a odio. In hac habitasse platea dictumst. Maecenas ut massa quis augue luctus tincidunt.",Sports,298.47,Voolith,,,,,,,,,,,,,,
981848,rhoncus mauris enim leo rhoncus sed vestibulum sit amet cursus id turpis integer,"Donec semper sapien a libero. Nam dui. Proin leo odio, porttitor id, consequat in, consequat ut, nulla. Sed accumsan felis. Ut at dolor quis odio consequat varius.",Sports,815.71,Bubbletube,,,,,,,,,,,,,,
966687,nulla ac enim in tempor turpis nec euismod scelerisque quam turpis adipiscing lorem vitae mattis nibh ligula nec,Sed vel enim sit amet nunc viverra dapibus. Nulla suscipit ligula in lacus. Curabitur at ipsum ac tellus semper interdum.,Sports,528.28,Gevee,,,,,,,,,,,,,,
115100,lorem ipsum dolor sit amet consectetuer adipiscing elit proin risus praesent lectus vestibulum quam sapien,"Morbi ut odio. Cras mi pede, malesuada in, imperdiet et, commodo vulputate, justo. In blandit ultrices enim. Lorem ipsum dolor sit amet, consectetuer adipiscing elit. Proin interdum mauris non ligula pellentesque ultrices. Phasellus id sapien in sapien iaculis congue.",Sports,930.16,Meevee,,,,,,,,,,,,,,
422829,ipsum dolor sit amet consectetuer adipiscing elit proin interdum mauris non ligula pellentesque ultrices phasellus,"Aliquam augue quam, sollicitudin vitae, consectetuer eget, rutrum at, lorem. Integer tincidunt ante vel ipsum.",Sports,828.77,Viva,,,,,,,,,,,,,,
738903,justo lacinia eget tincidunt eget tempus vel pede morbi porttitor lorem id ligula suspendisse ornare consequat,"Nam nulla. Integer pede justo, lacinia eget, tincidunt eget, tempus vel, pede. Morbi porttitor lorem id ligula. Suspendisse ornare consequat lectus. In est risus, auctor sed, tristique in, tempus sit amet, sem. Fusce consequat. Nulla nisl. Nunc nisl. Duis bibendum, felis sed interdum venenatis, turpis enim blandit mi, in porttitor pede justo eu massa.",Sports,127.66,Buzzdog,,,,,,,,,,,,,,
147688,cras pellentesque volutpat dui maecenas tristique est et tempus semper est quam pharetra magna ac consequat metus,"Suspendisse ornare consequat lectus. In est risus, auctor sed, tristique in, tempus sit amet, sem. Fusce consequat. Nulla nisl.",Sports,224.44,Meembee,,,,,,,,,,,,,,
685191,at turpis donec posuere metus vitae ipsum aliquam non mauris morbi non lectus aliquam,"Morbi quis tortor id nulla ultrices aliquet. Maecenas leo odio, condimentum id, luctus nec, molestie sed, justo. Pellentesque viverra pede ac diam. Cras pellentesque volutpat dui. Maecenas tristique, est et tempus semper, est quam pharetra magna, ac consequat metus sapien ut nunc. Vestibulum ante ipsum primis in faucibus orci luctus et ultrices posuere cubilia Curae; Mauris viverra diam vitae quam. Suspendisse potenti. Nullam porttitor lacus at turpis.",Sports,157.48,Browsecat,,,,,,,,,,,,,,
420949,mauris vulputate elementum nullam varius nulla facilisi cras non velit nec nisi vulputate,"Nullam orci pede, venenatis non, sodales sed, tincidunt eu, felis. Fusce posuere felis sed lacus. Morbi sem mauris, laoreet ut, rhoncus aliquet, pulvinar sed, nisl. Nunc rhoncus dui vel sem. Sed sagittis.",Sports,521.02,Jabberstorm,,,,,,,,,,,,,,
632520,duis bibendum felis sed interdum venenatis turpis enim blandit mi in porttitor pede justo eu massa donec dapibus duis,Praesent id massa id nisl venenatis lacinia.,Sports,845.84,Meejo,,,,,,,,,,,,,,
337787,purus phasellus in felis donec semper sapien a libero nam dui,"Donec posuere metus vitae ipsum. Aliquam non mauris. Morbi non lectus. Aliquam sit amet diam in magna bibendum imperdiet. Nullam orci pede, venenatis non, sodales sed, tincidunt eu, felis. Fusce posuere felis sed lacus. Morbi sem mauris, laoreet ut, rhoncus aliquet, pulvinar sed, nisl. Nunc rhoncus dui vel sem. Sed sagittis.",Sports,793.51,Kayveo,,,,,,,,,,,,,,
701388,velit eu est congue elementum in hac habitasse platea dictumst morbi vestibulum velit id pretium iaculis diam erat fermentum justo,"Ut at dolor quis odio consequat varius. Integer ac leo. Pellentesque ultrices mattis odio. Donec vitae nisi. Nam ultrices, libero non mattis pulvinar, nulla pede ullamcorper augue, a suscipit nulla elit ac nulla.",Sports,98.67,Skyvu,,,,,,,,,,,,,,
801452,ultrices aliquet maecenas leo odio condimentum id luctus nec molestie sed justo pellentesque viverra pede ac diam cras pellentesque volutpat,Etiam justo. Etiam pretium iaculis justo. In hac habitasse platea dictumst. Etiam faucibus cursus urna. Ut tellus. Nulla ut erat id mauris vulputate elementum. Nullam varius. Nulla facilisi. Cras non velit nec nisi vulputate nonummy. Maecenas tincidunt lacus at velit.,Sports,610.82,Youspan,,,,,,,,,,,,,,
234645,aliquet pulvinar sed nisl nunc rhoncus dui vel sem sed sagittis nam congue risus,Curabitur convallis. Duis consequat dui nec nisi volutpat eleifend. Donec ut dolor. Morbi vel lectus in quam fringilla rhoncus.,Sports,53.62,Vimbo,,,,,,,,,,,,,,
837660,erat fermentum justo nec condimentum neque sapien placerat ante nulla justo aliquam quis turpis,"Donec diam neque, vestibulum eget, vulputate ut, ultrices vel, augue. Vestibulum ante ipsum primis in faucibus orci luctus et ultrices posuere cubilia Curae; Donec pharetra, magna vestibulum aliquet ultrices, erat tortor sollicitudin mi, sit amet lobortis sapien sapien non mi. Integer ac neque. Duis bibendum. Morbi non quam nec dui luctus rutrum. Nulla tellus. In sagittis dui vel nisl.",Sports,724.15,Fanoodle,,,,,,,,,,,,,,
718954,orci luctus et ultrices posuere cubilia curae donec pharetra magna,"Donec quis orci eget orci vehicula condimentum. Curabitur in libero ut massa volutpat convallis. Morbi odio odio, elementum eu, interdum eu, tincidunt in, leo.",Sports,498.88,Omba,,,,,,,,,,,,,,
139096,cum sociis natoque penatibus et magnis dis parturient montes nascetur,"Suspendisse potenti. Cras in purus eu magna vulputate luctus. Cum sociis natoque penatibus et magnis dis parturient montes, nascetur ridiculus mus. Vivamus vestibulum sagittis sapien. Cum sociis natoque penatibus et magnis dis parturient montes, nascetur ridiculus mus. Etiam vel augue.",Sports,986.12,Flashpoint,,,,,,,,,,,,,,
892250,nunc nisl duis bibendum felis sed interdum venenatis turpis enim blandit,"Nunc nisl. Duis bibendum, felis sed interdum venenatis, turpis enim blandit mi, in porttitor pede justo eu massa.",Sports,4.85,Jaxnation,,,,,,,,,,,,,,
595016,vestibulum vestibulum ante ipsum primis in faucibus orci luctus et ultrices posuere cubilia curae nulla dapibus dolor vel est,"Vestibulum rutrum rutrum neque. Aenean auctor gravida sem. Praesent id massa id nisl venenatis lacinia. Aenean sit amet justo. Morbi ut odio. Cras mi pede, malesuada in, imperdiet et, commodo vulputate, justo. In blandit ultrices enim.",Sports,521.92,Zazio,,,,,,,,,,,,,,
166699,felis eu sapien cursus vestibulum proin eu mi nulla ac enim in,"Proin leo odio, porttitor id, consequat in, consequat ut, nulla. Sed accumsan felis. Ut at dolor quis odio consequat varius. Integer ac leo. Pellentesque ultrices mattis odio. Donec vitae nisi. Nam ultrices, libero non mattis pulvinar, nulla pede ullamcorper augue, a suscipit nulla elit ac nulla. Sed vel enim sit amet nunc viverra dapibus.",Sports,619.5,Skipfire,,,,,,,,,,,,,,
598198,posuere felis sed lacus morbi sem mauris laoreet ut rhoncus aliquet pulvinar sed nisl nunc rhoncus dui,"Nunc purus. Phasellus in felis. Donec semper sapien a libero. Nam dui. Proin leo odio, porttitor id, consequat in, consequat ut, nulla.",Sports,374.23,Avaveo,,,,,,,,,,,,,,
108000,neque libero convallis eget eleifend luctus ultricies eu nibh quisque id justo sit amet sapien,"Integer pede justo, lacinia eget, tincidunt eget, tempus vel, pede. Morbi porttitor lorem id ligula. Suspendisse ornare consequat lectus. In est risus, auctor sed, tristique in, tempus sit amet, sem. Fusce consequat. Nulla nisl. Nunc nisl.",Sports,71.31,Photobug,,,,,,,,,,,,,,
363057,quam sollicitudin vitae consectetuer eget rutrum at lorem integer tincidunt ante vel ipsum praesent blandit lacinia erat,"Nulla tellus. In sagittis dui vel nisl. Duis ac nibh. Fusce lacus purus, aliquet at, feugiat non, pretium quis, lectus. Suspendisse potenti. In eleifend quam a odio. In hac habitasse platea dictumst. Maecenas ut massa quis augue luctus tincidunt. Nulla mollis molestie lorem. Quisque ut erat.",Sports,707.19,Mynte,,,,,,,,,,,,,,
512790,sed justo pellentesque viverra pede ac diam cras pellentesque volutpat dui maecenas tristique,"In sagittis dui vel nisl. Duis ac nibh. Fusce lacus purus, aliquet at, feugiat non, pretium quis, lectus.",Sports,600.05,Skalith,,,,,,,,,,,,,,
667303,magna vulputate luctus cum sociis natoque penatibus et magnis dis parturient montes nascetur,Suspendisse potenti. In eleifend quam a odio. In hac habitasse platea dictumst. Maecenas ut massa quis augue luctus tincidunt.,Sports,551.28,Brainbox,,,,,,,,,,,,,,
510,TUTEMO,over a door or standing on a surface  then turn the clock face to suit the location. A plastic inner pot makes the plant pot waterproof. The table surface in ash veneer and legs in solid birch give a warm,firmer,57.6,Jetpulse,Elvera Baldinotti,ebaldinottie5@oakley.com,367-465-6620,81958 Emmet Center,Antabamba,,,2912,Avamm,29 Morningstar Center,Grujugan,,,931-298-3838
497,VEDDINGE,stain resistant and easy to care for since the rug is made of synthetic fibres. Suitable for both indoor and outdoor use. Hinges with integrated dampers catch the door and close it slowly,softer,405.64,Avamm,Lyn De Michele,ldeds@homestead.com,685-325-0364,1 Waywood Way,Bestala,,,2059,Skyvu,7 Continental Crossing,Yuanlin,,,640-609-0223
757,KALLARP,they are reliable and tested for safety. You can use this window catch for windows that open inwards or outwards as well as for sliding windows. A durable quilt cover of polyester and cotton with playful patterns in the form of small figures. Soft against your child's skin,2 bowls,51.89,Wordify,Marylinda Meachen,mmeachenl0@domainmarket.com,331-191-6221,2 Randy Lane,Qing’an,,,6934,Talane,932 Parkside Park,Legok,,,745-781-8223
627,HISSMON,because the chair can be easily adjusted to 5 different heights  38,2 doors,875.95,Devpulse,Luz Fearnyhough,lfearnyhoughhe@delicious.com,849-439-9674,11340 Holmberg Hill,Honglu,,,9110,Skidoo,9 Moulton Pass,Baiqi,,,644-892-3886
367,TEJN,sitting,3 steps,983.15,Oyoba,Rikki Ragsdall,rragsdalla6@ameblo.jp,468-526-9326,347 Paget Avenue,Picungbera,,,5689,Photofeed,0 Nancy Avenue,Hetoudian,,,212-807-1273
38,PSIG,soft and nice against your child's skin. View more product information By combining the different sizes you can use the wall space in the best way,Cushion,700.36,Fadeo,Joleen Tamblingson,jtamblingson11@cafepress.com,357-749-3201,772 Jana Park,Longchiqiao,,,9025,Aimbu,47669 Harper Way,Tangqian,,,875-616-5619
878,SNIG,and therefore unique. The polyester,Cushion,207.83,Youopia,Caresse Harrema,charremaod@studiopress.com,416-259-2099,9 Mendota Lane,Chenxikou,,,5602,Skiptube,608 Loomis Circle,Zall-Herr,,,678-482-6980
894,KRAMA,complete the phone with VITAHULT wireless charging cover. Chenille fabric feels ultra soft against your skin. Also suitable for hot drinks. View more product information The clean lines of these smooth stainless-steel handles give your kitchen a modern touch. View more product information View more product information Create your own personalised pendant or floor lamp by combining the lamp shade with your choice of cord set or base. Inner cushions are sold separately. View more product information Extra soft since the bedspread and cushion cover are quilted. Jacquard weave gives the cushion cover a pattern with a subtle,Cushion,298.58,Feedspan,Knox Hassan,khassanot@gizmodo.com,159-201-9937,1 Bowman Parkway,Karangtengah,,,8842,Jaxnation,060 Northland Road,Xijiao,,,499-813-6356
480,ODDVALD,so you can keep several on hand and store them on the same space as one. Provides a good environment for seeds to sprout and plants to grow. Bathroom mixer tap is sold separately. Smooth-running and soft-closing drawers with pull-out stop. View more product information The jar has an aroma-tight seal,Finials,577.77,Fivebridge,Shela Fishly,sfishlydb@ftc.gov,206-948-0636,5 Mendota Lane,Gaborone,,,3931,Ainyx,27371 Cottonwood Street,Ozubulu,,,601-743-9511
176,TOFTBO,snow and dirt. View more product information The lyocell,Picture,306.24,Rhyloo,Marcus Furse,mfurse4v@taobao.com,881-736-3160,174 Twin Pines Hill,Naberera,,,3431,Edgepulse,8398 Comanche Circle,Langnga,,,225-728-6604
926,PYTTESM,which is an easy-care and hardwearing natural material. Has a ceramic grinding mechanism which is harder and more durable than steel grinders. View more product information The clock is also a good storage place for small items. View more product information You can create your own unique solution by freely combining cabinets of different sizes,Trellis,259.87,Browseblab,Katie Sherston,ksherstonpp@newsvine.com,355-642-3886,4649 Forest Run Circle,Lyntupy,,,6831,Skibox,259 Swallow Court,Međa,,,157-560-9463
533,SDERHAMN,airy feel. View more product information You sit comfortably thanks to the restful flexibility of the seat and back. Each bowl has been mouthblown by a skilled craftsman. View more product information The densely woven curtains darken the room and provide privacy by preventing people outside from seeing into the room. View more product information Shade is sold separately. View more product information View more product information The bedlinen feels soft against your skin and retains its vivid colours for a long time since the yarn is dyed before weaving. The cushion cover is made of ramie,Trestle,957.45,Jabbertype,Arly Doddemeade,adoddemeadees@linkedin.com,270-873-7122,8 Emmet Road,Duba,,,5935,Browseblab,2696 Springs Road,Cigalontang,,,982-780-2497
775,TORKIS,so it can be pulled out as your child grows. Cotton,Worktop,419.93,Thoughtblab,Gian Sallier,gsallierli@comcast.net,781-882-8392,9 Village Parkway,Yanglin,,,870,Fliptune,245 Carioca Alley,Banjar Parekan,,,463-226-6742
686,EKBACKEN,or more bulky items like handbags and toys. It all depends on which of the 3 cabinet sizes you choose. View more product information The armchair is lightweight and easy to move if you want to clean the floor or rearrange the furniture. The polyester filling holds its shape and gives your body soft support. Cotton velvet gives depth to the colour and softness to the touch. Contact areas with soft,Writing,501.93,Skilith,Berne Prium,bpriumj1@psu.edu,925-899-5188,631 Sundown Park,Tân Sơn,,,2714,Yadel,1781 Killdeer Park,Xihanling,,,696-616-7257
135,JENNYLUND,receipts,cabinet,681.08,Jaloo,Tirrell De Lisle,tde3q@mac.com,104-668-3258,1 Erie Circle,Liquica,,,6965,Flashpoint,28829 Chive Pass,Čapljina,,,746-488-3576
934,TUTIG,and choose covers to fit your style. View more product information You can use the removable tray for serving. You can store everything from throws and pillows to newspapers and yarn in the basket - or let it stay empty to give an open,outdoor,782.84,Voonix,Jim Gussin,jgussinpx@mozilla.org,690-402-7020,8146 Kings Pass,Pirca,,,6748,Kazio,66983 Bunting Drive,Baiyanghe,,,608-811-0938
959,GSPA,so you can keep several on hand and store them on the same space as one. ME 311 The price reflects selected options View more product information You can customise spacing as you need,outdoor,293.39,Eimbee,Celeste Gheeraert,cgheeraertqm@hugedomains.com,861-162-5549,335 Jenna Point,Thị Trấn Than Uyên,,,6650,Thoughtworks,08217 Tennessee Lane,Takokak,,,901-589-7098
928,SKOJIG,sleek door that brings a bright and modern expression to your kitchen. View more product information The clean lines of these handles give your kitchen a minimalist,outdoor,117.04,Meetz,Jessey Cogdon,jcogdonpr@cargocollective.com,681-964-7384,0653 Heffernan Terrace,Tawun,,,5211,Oyondu,58 Banding Junction,Thành Phố Nam Định,,,293-992-3505
